{"baseline_artifact":{"content_hash":"sha256:d691b498eb96556d2c5d3a68f675eaa814b425fa8c1e73e91b6cf5eede475dd5","record_id":"a5ada795-db2f-5625-aed9-1b619411be17"},"cutover_state":"blocked_pending_human_adjudication","decision_authority":"human","deltas":[{"available_dispositions":["accept_preserved_meaning","accept_beneficial_enrichment","require_normalization","reject_semantic_drift","insufficient_evidence"],"baseline_value":"The presence of a redacted credential-like value in a documentation file suggests a potential exposure. The unresolved credential-like value may represent a potential exposure if it is a real secret.","default_if_unresolved":"block_cutover","delta_id":"3c48955f-811c-5591-8063-b34acf883ac3","dimension":"assessments","downstream_consequence":"Changes the rationale presented to capability-risk reviewers.","json_pointer":"/assessments/0/rationale","materiality":"potentially_substantive","review_question":"Does the changed likelihood wording preserve the accepted assessment meaning?","shadow_value":"The presence of a redacted credential-like value in a documentation file indicates a potential exposure. The unresolved credential-like value may represent a potential exposure if it is a real secret."},{"available_dispositions":["accept_preserved_meaning","accept_beneficial_enrichment","require_normalization","reject_semantic_drift","insufficient_evidence"],"baseline_value":[],"default_if_unresolved":"block_cutover","delta_id":"7404c08d-af57-570b-8dbb-366d8bb13d53","dimension":"conflicts","downstream_consequence":"Changes whether downstream reports and reviewers see an unresolved conflict.","json_pointer":"/conflicts","materiality":"substantive","review_question":"Should the shadow-added DC-001 question be retained as an explicit capability conflict?","shadow_value":[{"conflict_id":"DC-001","evidence_refs":[],"statement":"Should the redacted credential-like value be classified as a confirmed secret, likely secret, or benign/nonsecret?"}]},{"available_dispositions":["accept_preserved_meaning","accept_beneficial_enrichment","require_normalization","reject_semantic_drift","insufficient_evidence"],"baseline_value":"secrets_exposure","default_if_unresolved":"block_cutover","delta_id":"45c67816-e5f1-58bb-9dba-188f8f6d18b5","dimension":"risk_register","downstream_consequence":"Changes risk taxonomy, aggregation, filtering, and trend analysis.","json_pointer":"/extensions/capability/role/risk_register/0/risk_category","materiality":"substantive","review_question":"Is security_exposure an acceptable replacement for secrets_exposure?","shadow_value":"security_exposure"},{"available_dispositions":["accept_preserved_meaning","accept_beneficial_enrichment","require_normalization","reject_semantic_drift","insufficient_evidence"],"baseline_value":[],"default_if_unresolved":"block_cutover","delta_id":"30678370-5957-51b2-b97b-4a8aa53a8cc0","dimension":"risk_register","downstream_consequence":"Changes dependency and blast-radius reasoning.","json_pointer":"/extensions/capability/role/risk_register/0/dependency_chain","materiality":"potentially_substantive","review_question":"Is adding PRODUCT-ALPHA to the dependency chain supported and useful?","shadow_value":["PRODUCT-ALPHA"]},{"available_dispositions":["accept_preserved_meaning","accept_beneficial_enrichment","require_normalization","reject_semantic_drift","insufficient_evidence"],"baseline_value":"The presence of a redacted credential-like value in a documentation file suggests a potential exposure.","default_if_unresolved":"block_cutover","delta_id":"34373961-5ac5-579d-b9b6-039e0537e7a4","dimension":"risk_register","downstream_consequence":"May change perceived evidentiary strength.","json_pointer":"/extensions/capability/role/risk_register/0/likelihood_basis","materiality":"potentially_substantive","review_question":"Does the likelihood-basis wording preserve uncertainty?","shadow_value":"The presence of a redacted credential-like value in a documentation file indicates a potential exposure."},{"available_dispositions":["accept_preserved_meaning","accept_beneficial_enrichment","require_normalization","reject_semantic_drift","insufficient_evidence"],"baseline_value":"Potential unauthorized access to the system if the redacted credential-like value is a real secret.","default_if_unresolved":"block_cutover","delta_id":"7d395b79-c4b2-5a76-8230-382eb7212010","dimension":"risk_register","downstream_consequence":"Changes mission consequence communicated to leadership.","json_pointer":"/extensions/capability/role/risk_register/0/mission_effect","materiality":"substantive","review_question":"Does the generalized sensitive-information mission effect preserve the accepted unauthorized-access meaning?","shadow_value":"Potential exposure of sensitive information if the redacted value is a real secret."},{"available_dispositions":["accept_preserved_meaning","accept_beneficial_enrichment","require_normalization","reject_semantic_drift","insufficient_evidence"],"baseline_value":{"action_owner":"security_engineer","contributing_causes":["The presence of a redacted credential-like value in a documentation file."],"cost_schedule_mission_tradeoffs":[],"decision_owner":"security_engineer","dependencies":[],"expected_consequence_effect":"high","expected_evidence":"Manual classification of the redacted credential-like value.","expected_probability_effect":"medium","proposed_control":"Manual classification by the security team.","remaining_unknowns":["The exact impact of the unresolved credential-like value is unknown without further classification."],"sequencing":[],"side_effects":[],"target_condition":"Classify the redacted value as confirmed secret, likely secret, or benign/nonsecret.","verification_method":"manual classification by security team"},"default_if_unresolved":"block_cutover","delta_id":"d62b1d8d-8dce-5c6d-8351-8acfef931304","dimension":"risk_register","downstream_consequence":"Changes the action package human experts may consider.","json_pointer":"/extensions/capability/role/risk_register/0/treatment_options/0","materiality":"substantive","review_question":"Are the shadow treatment wording, sequencing, evidence, and verification changes acceptable?","shadow_value":{"action_owner":"security_engineer","contributing_causes":["The presence of a redacted credential-like value in a documentation file."],"cost_schedule_mission_tradeoffs":[],"decision_owner":"security_engineer","dependencies":[],"expected_consequence_effect":"high","expected_evidence":"Manual classification result.","expected_probability_effect":"medium","proposed_control":"Manual classification by security team.","remaining_unknowns":["The exact impact of the unresolved credential-like value is unknown without further classification."],"sequencing":"immediate","side_effects":[],"target_condition":"Classify the redacted value as confirmed secret, likely secret, or benign/nonsecret.","verification_method":"Manual review and validation."}}],"differing_dimensions":["assessments","conflicts","risk_register"],"effect":"review_request_only","generated_at":"2026-08-01T15:00:00Z","isolation":{"baseline_workflow_changed":false,"deployment_effect":"none","report_package_changed":false},"packet_hash":"sha256:3d87fb628ee30a280c60fc564ba9b365b6225a02119654c1059ef300fa5e9810","packet_id":"047813b4-5125-56f0-9e5c-81803cd078e2","packet_version":"1.0.0","preserved_dimensions":["capa_options","confidence","coverage","decisions_requested","findings"],"required_decision_authority":"enterprise-risk-acceptance-authority","shadow_artifact":{"content_hash":"sha256:7a656f870ac89abe53ecfd9e25082ea5e7d633a646922e96745ea3da706f2e63","record_id":"2cd0b5e6-0f65-521a-93bf-c813f3b85ab8"},"source_comparison":{"content_hash":"sha256:faa4a88cc73e7606027e4216e035ee427a016072f7e016b16cd4f1b96a6b7894","record_id":"571e8285-7051-51ab-a53e-ad8de1ea7832"}}
